{
    "apiVersion": "1",
    "schemaVersion": "1.0.0",
    "locale": "en",
    "type": "mixed_quote_line_validation",
    "lines": [
        {
            "entryId": "25000000-0000-4000-8000-000000000104",
            "lineKind": "configured_product",
            "resolution": "resolved_article_number",
            "model": "FGD X15+PVC",
            "publicPath": "/products/fgd-x15-pvc/",
            "articleNumber": "GDHEPRD000172",
            "selection": {
                "type": "article_number",
                "articleNumber": "GDHEPRD000172",
                "lengthMeters": 6,
                "color": {
                    "code": "ivory-white",
                    "label": "Ivory White"
                }
            },
            "packaging": {
                "basePackaging": "standard",
                "logoPrinting": false,
                "protectionArrangement": null
            },
            "quantityUnit": "piece",
            "quantity": 2
        },
        {
            "entryId": "25000000-0000-4000-8000-000000000105",
            "lineKind": "catalog_accessory",
            "resolution": "resolved_article_number",
            "model": "TASK-025 ACCESSORY",
            "publicPath": null,
            "articleNumber": "GDHEPRD000901",
            "quantityUnit": "piece",
            "quantity": 3
        }
    ]
}
